{
  "_schema_version": "1.0.0",
  "contract_version": "1.0.0",
  "block": {
    "name": "FB_VALVE_3WAY",
    "version": "1.0.0",
    "type": "FB",
    "domain": "valve",
    "device_type": "3Way",
    "platform": "S7_1500_TIA_V18+",
    "source": "Factory",
    "lifecycle": "DRAFT",
    "description": "3-way diverter valve. Two coils (A/B positions), dual feedback, conflict detection."
  },
  "interface": {
    "inputs": [
      {
        "name": "in_bEnable",
        "iec_type": "Bool",
        "default": false,
        "required": true
      },
      {
        "name": "in_bReset",
        "iec_type": "Bool",
        "default": false,
        "required": true
      },
      {
        "name": "in_bManualMode",
        "iec_type": "Bool",
        "default": false,
        "required": true
      },
      {
        "name": "in_bPositionACmd",
        "iec_type": "Bool",
        "default": false,
        "required": true
      },
      {
        "name": "in_bPositionBCmd",
        "iec_type": "Bool",
        "default": false,
        "required": true
      },
      {
        "name": "in_bFeedbackPositionA",
        "iec_type": "Bool",
        "default": false,
        "required": true
      },
      {
        "name": "in_bFeedbackPositionB",
        "iec_type": "Bool",
        "default": false,
        "required": true
      },
      {
        "name": "in_tPositionTimeout",
        "iec_type": "Time",
        "default": "T#5S",
        "required": true
      }
    ],
    "outputs": [
      {
        "name": "out_bOutputA",
        "iec_type": "Bool",
        "default": false,
        "required": true
      },
      {
        "name": "out_bOutputB",
        "iec_type": "Bool",
        "default": false,
        "required": true
      },
      {
        "name": "out_bReadyA",
        "iec_type": "Bool",
        "default": false,
        "required": true
      },
      {
        "name": "out_bReadyB",
        "iec_type": "Bool",
        "default": false,
        "required": true
      },
      {
        "name": "out_bReady",
        "iec_type": "Bool",
        "default": false,
        "required": true
      },
      {
        "name": "out_bError",
        "iec_type": "Bool",
        "default": false,
        "required": true
      },
      {
        "name": "out_wErrorCode",
        "iec_type": "Word",
        "default": "16#0000",
        "required": true
      },
      {
        "name": "out_nState",
        "iec_type": "Int",
        "default": 0,
        "required": true
      }
    ],
    "in_out": [],
    "static_vars": [
      {
        "name": "s_bResetEdgeMem",
        "iec_type": "Bool"
      },
      {
        "name": "s_bResetTrig",
        "iec_type": "Bool"
      },
      {
        "name": "s_nStep",
        "iec_type": "Int"
      },
      {
        "name": "s_tonPositionTO",
        "iec_type": "TON"
      }
    ]
  },
  "constraints": {
    "mandatory_regions": [
      "01_INPUT_VALIDATION",
      "02_STATE_MACHINE",
      "03_OUTPUT_LOGIC",
      "04_DIAGNOSTICS"
    ],
    "mandatory_behaviors": [
      {
        "id": "B-3W-001",
        "description": "Reset rising edge",
        "check_pattern": "s_bResetTrig\\s*:=\\s*.*in_bReset.*AND\\s*NOT.*s_bResetEdgeMem",
        "severity": "MUST"
      },
      {
        "id": "B-3W-002",
        "description": "Position timeout timer present",
        "check_pattern": "s_tonPositionTO",
        "severity": "MUST"
      },
      {
        "id": "B-3W-003",
        "description": "A and B outputs mutually exclusive",
        "check_pattern": "out_bOutputA.*out_bOutputB|NOT.*out_bOutputB|NOT.*out_bOutputA|16#0003",
        "severity": "MUST"
      },
      {
        "id": "B-3W-004",
        "description": "Error code 16#0001 present",
        "check_pattern": "16#0001",
        "severity": "MUST"
      },
      {
        "id": "B-3W-005",
        "description": "Error code 16#0002 present",
        "check_pattern": "16#0002",
        "severity": "MUST"
      },
      {
        "id": "B-3W-006",
        "description": "FB name is FB_VALVE_3WAY",
        "check_pattern": "FUNCTION_BLOCK\\s+\"?FB_VALVE_3WAY\"?",
        "severity": "MUST"
      },
      {
        "id": "B-3W-007",
        "description": "Optimized Access declared",
        "check_pattern": "S7_Optimized_Access\\s*:=\\s*'TRUE'",
        "severity": "MUST"
      }
    ],
    "forbidden_patterns": [
      "CURRENT_TIME\\(\\)",
      "GET_SYSTIME\\(\\)"
    ],
    "error_codes": [
      {
        "hex": "16#0001",
        "meaning": "Position A cmd but no feedback within timeout"
      },
      {
        "hex": "16#0002",
        "meaning": "Position B cmd but no feedback within timeout"
      },
      {
        "hex": "16#0003",
        "meaning": "Both A and B feedback active simultaneously"
      }
    ]
  },
  "gate": {
    "checks": [
      {
        "id": "G-01",
        "type": "structural",
        "description": "Structural balance",
        "required": true
      },
      {
        "id": "G-02",
        "type": "contract_interface",
        "description": "Required ports",
        "required": true
      },
      {
        "id": "G-03",
        "type": "contract_behavior",
        "description": "MUST behaviors",
        "required": true
      },
      {
        "id": "G-04",
        "type": "contract_error_codes",
        "description": "Error codes in SCL",
        "required": true
      },
      {
        "id": "G-05",
        "type": "forbidden_pattern",
        "description": "No proprietary calls",
        "required": true
      },
      {
        "id": "G-06",
        "type": "plcrex",
        "description": "PLCreX optional",
        "required": false
      }
    ]
  },
  "prompt_binding": {
    "file": "04_AI_PROMPTS/code_gen/valve/PROMPT_VALVE_3WAY.md",
    "version": "1.0.0",
    "last_synced": "2026-05-30"
  },
  "duplicate_detection": {
    "alternatives": [
      "FB_VALVE_ONOFF"
    ],
    "note": "3-way diverter. Use OnOff for simple 2-way isolation valves."
  },
  "meta": {
    "source": "factory",
    "license": "MIT",
    "safety_class": "STANDARD",
    "target_platform": "TIA Portal V18+",
    "compatible_tia": [
      "V18",
      "V19"
    ]
  },
  "behaviors": [],
  "acceptance": {
    "contract_check": true,
    "compile_check": true,
    "sim_test": true,
    "human_signoff": true
  }
}