{
  "_schema_version": "1.0.0",
  "contract_version": "1.0.0",
  "block": {
    "name": "FB_VALVE_MODULATING",
    "version": "1.0.0",
    "type": "FB",
    "domain": "valve",
    "device_type": "Modulating",
    "platform": "S7_1500_TIA_V18+",
    "source": "Factory",
    "lifecycle": "DRAFT",
    "description": "Continuously modulating valve control. Analog setpoint (0-100%), feedback, deadband, at-setpoint detection."
  },
  "interface": {
    "inputs": [
      {
        "name": "in_bEnable",
        "iec_type": "Bool",
        "default": false,
        "required": true
      },
      {
        "name": "in_bReset",
        "iec_type": "Bool",
        "default": false,
        "required": true
      },
      {
        "name": "in_bManualMode",
        "iec_type": "Bool",
        "default": false,
        "required": true
      },
      {
        "name": "in_rSetpointPct",
        "iec_type": "Real",
        "default": 0.0,
        "required": true,
        "description": "Setpoint 0.0-100.0%"
      },
      {
        "name": "in_rFeedbackPct",
        "iec_type": "Real",
        "default": 0.0,
        "required": true,
        "description": "Position feedback 0.0-100.0%"
      },
      {
        "name": "in_rDeadbandPct",
        "iec_type": "Real",
        "default": 2.0,
        "required": true,
        "description": "At-setpoint deadband %"
      },
      {
        "name": "in_rManualSetPct",
        "iec_type": "Real",
        "default": 0.0,
        "required": true,
        "description": "Manual mode setpoint"
      },
      {
        "name": "in_tFeedbackTimeout",
        "iec_type": "Time",
        "default": "T#10S",
        "required": true
      }
    ],
    "outputs": [
      {
        "name": "out_rOutputPct",
        "iec_type": "Real",
        "default": 0.0,
        "required": true,
        "description": "Analog output 0.0-100.0%"
      },
      {
        "name": "out_rDeviation",
        "iec_type": "Real",
        "default": 0.0,
        "required": true
      },
      {
        "name": "out_bAtSetpoint",
        "iec_type": "Bool",
        "default": false,
        "required": true
      },
      {
        "name": "out_bReady",
        "iec_type": "Bool",
        "default": false,
        "required": true
      },
      {
        "name": "out_bError",
        "iec_type": "Bool",
        "default": false,
        "required": true
      },
      {
        "name": "out_wErrorCode",
        "iec_type": "Word",
        "default": "16#0000",
        "required": true
      },
      {
        "name": "out_nState",
        "iec_type": "Int",
        "default": 0,
        "required": true
      }
    ],
    "in_out": [],
    "static_vars": [
      {
        "name": "s_bResetEdgeMem",
        "iec_type": "Bool"
      },
      {
        "name": "s_bResetTrig",
        "iec_type": "Bool"
      },
      {
        "name": "s_nStep",
        "iec_type": "Int"
      },
      {
        "name": "s_tonFeedbackTO",
        "iec_type": "TON"
      }
    ]
  },
  "constraints": {
    "mandatory_regions": [
      "01_INPUT_VALIDATION",
      "02_STATE_MACHINE",
      "03_OUTPUT_LOGIC",
      "04_DIAGNOSTICS"
    ],
    "mandatory_behaviors": [
      {
        "id": "B-VM-001",
        "description": "Reset rising edge",
        "check_pattern": "s_bResetTrig\\s*:=\\s*.*in_bReset.*AND\\s*NOT.*s_bResetEdgeMem",
        "severity": "MUST"
      },
      {
        "id": "B-VM-002",
        "description": "Feedback timeout timer present",
        "check_pattern": "s_tonFeedbackTO",
        "severity": "MUST"
      },
      {
        "id": "B-VM-003",
        "description": "Setpoint range clamped 0-100",
        "check_pattern": "0\\.0|100\\.0|clamp|MIN|MAX",
        "severity": "MUST"
      },
      {
        "id": "B-VM-004",
        "description": "At-setpoint deadband check",
        "check_pattern": "in_rDeadbandPct|Deadband|deadband",
        "severity": "MUST"
      },
      {
        "id": "B-VM-005",
        "description": "Error code 16#0001 present",
        "check_pattern": "16#0001",
        "severity": "MUST"
      },
      {
        "id": "B-VM-006",
        "description": "FB name is FB_VALVE_MODULATING",
        "check_pattern": "FUNCTION_BLOCK\\s+\"?FB_VALVE_MODULATING\"?",
        "severity": "MUST"
      },
      {
        "id": "B-VM-007",
        "description": "Optimized Access declared",
        "check_pattern": "S7_Optimized_Access\\s*:=\\s*'TRUE'",
        "severity": "MUST"
      }
    ],
    "forbidden_patterns": [
      "CURRENT_TIME\\(\\)",
      "GET_SYSTIME\\(\\)"
    ],
    "error_codes": [
      {
        "hex": "16#0001",
        "meaning": "Feedback signal not responding within in_tFeedbackTimeout"
      },
      {
        "hex": "16#0002",
        "meaning": "Setpoint out of valid range (< 0% or > 100%)"
      }
    ]
  },
  "gate": {
    "checks": [
      {
        "id": "G-01",
        "type": "structural",
        "description": "Structural balance",
        "required": true
      },
      {
        "id": "G-02",
        "type": "contract_interface",
        "description": "Required ports",
        "required": true
      },
      {
        "id": "G-03",
        "type": "contract_behavior",
        "description": "MUST behaviors",
        "required": true
      },
      {
        "id": "G-04",
        "type": "contract_error_codes",
        "description": "Error codes in SCL",
        "required": true
      },
      {
        "id": "G-05",
        "type": "forbidden_pattern",
        "description": "No proprietary calls",
        "required": true
      },
      {
        "id": "G-06",
        "type": "plcrex",
        "description": "PLCreX optional",
        "required": false
      }
    ]
  },
  "prompt_binding": {
    "file": "04_AI_PROMPTS/code_gen/valve/PROMPT_VALVE_MODULATING.md",
    "version": "1.0.0",
    "last_synced": "2026-05-30"
  },
  "duplicate_detection": {
    "alternatives": [
      "FB_VALVE_PROPORTIONAL"
    ],
    "note": "Use Modulating for on/off or proportional position. For PID-controlled valves, use with FB_PID_WRAPPER."
  },
  "meta": {
    "source": "factory",
    "license": "MIT",
    "safety_class": "STANDARD",
    "target_platform": "TIA Portal V18+",
    "compatible_tia": [
      "V18",
      "V19"
    ]
  },
  "behaviors": [],
  "acceptance": {
    "contract_check": true,
    "compile_check": true,
    "sim_test": true,
    "human_signoff": true
  }
}